{
  "schemaVersion": 2,
  "appId": "owl-fixture-flutter",
  "release": "2026.09.05-f1a2b3c",
  "runtime": "flutter-web",
  "framework": "flutter",
  "toolchain": "flutter 3.35.1 (wasm)",
  "entrypoint": "flutter_bootstrap.js",
  "requiresCrossOriginIsolation": true,
  "assets": [
    {
      "id": "flutter_bootstrap.js",
      "url": "https://assets.ores-wasm-loaders.test/releases/owl-fixture-flutter/2026.09.05-f1a2b3c/flutter_bootstrap.js",
      "kind": "script",
      "bytes": 12288,
      "sha256": "5c64aaa65dd7fdf78cc2fb14e8fc0f4833aecf44bb331e6d17038f650c781184",
      "prepare": true,
      "role": "bootstrap",
      "stage": "critical"
    },
    {
      "id": "main.dart.wasm",
      "url": "https://assets.ores-wasm-loaders.test/releases/owl-fixture-flutter/2026.09.05-f1a2b3c/main.dart.wasm",
      "kind": "wasm",
      "bytes": 2400000,
      "sha256": "e857e1ed3c3da3f27f576b04da194368d6fad8308c5984a7e6345c84b178efc4",
      "prepare": true,
      "role": "module",
      "stage": "critical"
    },
    {
      "id": "main.dart.mjs",
      "url": "https://assets.ores-wasm-loaders.test/releases/owl-fixture-flutter/2026.09.05-f1a2b3c/main.dart.mjs",
      "kind": "module",
      "bytes": 96000,
      "sha256": "84cb5967a661accb75e942dd28b0cad8fb748397cabbb624c3e288612cfac862",
      "prepare": true,
      "role": "glue",
      "stage": "critical"
    },
    {
      "id": "main.dart.js",
      "url": "https://assets.ores-wasm-loaders.test/releases/owl-fixture-flutter/2026.09.05-f1a2b3c/main.dart.js",
      "kind": "script",
      "bytes": 1800000,
      "sha256": "ec218fcea21891bbff4bd508bc955ae1b5cce84be11bb1b7857cebee0ced62b1",
      "prepare": true,
      "role": "fallback",
      "stage": "critical"
    },
    {
      "id": "assets-AssetManifest.bin.json",
      "url": "https://assets.ores-wasm-loaders.test/releases/owl-fixture-flutter/2026.09.05-f1a2b3c/assets/AssetManifest.bin.json",
      "kind": "data",
      "bytes": 4096,
      "sha256": "4422b0d641810599e43c8fe7d531aa89c7615bb52a16f10914010412dbd2b14c",
      "prepare": true,
      "role": "asset",
      "stage": "critical"
    },
    {
      "id": "assets-FontManifest.json",
      "url": "https://assets.ores-wasm-loaders.test/releases/owl-fixture-flutter/2026.09.05-f1a2b3c/assets/FontManifest.json",
      "kind": "data",
      "bytes": 1024,
      "sha256": "0153edf3ff9cf0c8010fb25ace434458af2a3b9b555c827a132308d385fb151b",
      "prepare": true,
      "role": "asset",
      "stage": "critical"
    },
    {
      "id": "assets-fonts-Placeholder.otf",
      "url": "https://assets.ores-wasm-loaders.test/releases/owl-fixture-flutter/2026.09.05-f1a2b3c/assets/fonts/Placeholder.otf",
      "kind": "font",
      "bytes": 240000,
      "sha256": "51bf39002dcde533ea03dce1702c73e36835158d0a6ff5c6ffa4ce2ab3b1c8f6",
      "prepare": true,
      "role": "asset",
      "stage": "optional"
    },
    {
      "id": "canvaskit-skwasm.wasm",
      "url": "https://assets.ores-wasm-loaders.test/releases/owl-fixture-flutter/2026.09.05-f1a2b3c/canvaskit/skwasm.wasm",
      "kind": "wasm",
      "bytes": 900000,
      "sha256": "cdc51df4272917ed0f5379420b66213e56e253368eecfeca1a103f65b53614d7",
      "prepare": true,
      "role": "asset",
      "stage": "optional"
    },
    {
      "id": "assets-help-onboarding.json",
      "url": "https://assets.ores-wasm-loaders.test/releases/owl-fixture-flutter/2026.09.05-f1a2b3c/assets/help/onboarding.json",
      "kind": "data",
      "bytes": 32000,
      "sha256": "97f96737a27936e2ea65cc436d2f5bdc1559ac29ed388fb096230fcf35b67b5a",
      "prepare": false,
      "role": "asset",
      "stage": "lazy"
    }
  ],
  "prepareBudget": {
    "maxBytes": 5453408,
    "maxConcurrency": 4,
    "furthestStage": "fetch"
  },
  "activation": {
    "mode": "attach-view",
    "hostSelector": "#app-view"
  }
}
